{
  "id": "npm_preinstall_payload_execution",
  "name": "NPM preinstall lifecycle payload execution",
 "description": "Worked example of an effective dependency_fetch mutant on the git target. Models a compromised package release that adds or modifies a package.json preinstall lifecycle hook to execute an attacker-controlled payload during dependency installation, dropping a marker file. This operator carries an effect block so the validator can classify the mutant as 'effective' (not merely build_valid).",
  "target_build_phase": "dependency_fetch",
  "scheme": "dependency_aware",
  "mode": "replace",
  "injection_location": {
    "file_glob": "package.json",
    "field": "scripts.preinstall"
  },
  "placeholders": {
    "PACKAGE_FILE": "relative path to the package.json file being modified"
 },
  "attacker_values": {
    "MARKER_ID": "git001"
  },
  "template": {
    "file_path": "{{PACKAGE_FILE}}",
    "replacement_value": "touch /tmp/PWNED_npm_{{MARKER_ID}}"
  },
  "preconditions": [
    "project installs npm dependencies from a package manifest or lockfile",
    "the targeted package can be replaced or updated with a compromised release",
    "npm lifecycle scripts are enabled during installation"
  ],
  "effect": {
    "observable": "file_write",
    "check": {
      "marker": "PWNED_npm"
    },
    "requires": []
  },
  "source_attacks": [
    "ua-parser-js (CVE-2021-4229)"
  ]
}
